{
  "$schema": "https://test.crausaz.click/schema.json",
  "name": "Composal Badging",
  "description": "Module allowing users to scan their badge through a RFID reader to clock in and out",
  "version": "1.0.0",
  "author": "Nicolas Crausaz",
  "icon": "composal.svg",
  "requires": ["http", "keyboard"],
  "specificConfig": {
    "authToken": {
      "type": "secret",
      "label": "Authentication token",
      "description": "The Bearer token used to authenticate the request",
      "value": "NUYC7IzclxqvGI3NyTKrzApO379nmeAyDE-2BYci_H6-MYugWyzqRFm362LHiTb1"
    },
    "composalUrl": {
      "type": "text",
      "label": "Composal URL",
      "description": "The URL of the your Composal instance",
      "value": "https://yalk-composal-nico.herokuapp.com/api/badging/toggle"
    }
  }
}
